{
  "links": [
    {
      "data_license_id": "CC-BY-SA-4.0",
      "git_lfs_oid": "c7d17ab4af3551a4b2883c6e18c1f3a49b6c19d30d37fad762802aeeb275d948",
      "physical_dataset_id": "ord_dataset-2be11f57f3304e678ea8469baf6dd1bc",
      "reaction_count": 1152,
      "size_bytes": 112943,
      "source_file": "data/2b/ord_dataset-2be11f57f3304e678ea8469baf6dd1bc.parquet",
      "source_file_url": "https://github.com/open-reaction-database/ord-data/blob/83f971f586f6ad18f358ae4ae99d045e94ed2066/data/2b/ord_dataset-2be11f57f3304e678ea8469baf6dd1bc.parquet",
      "source_sha256": "c7d17ab4af3551a4b2883c6e18c1f3a49b6c19d30d37fad762802aeeb275d948",
      "upstream_revision": "83f971f586f6ad18f358ae4ae99d045e94ed2066",
      "verification_status": "verified"
    }
  ],
  "logical_dataset_id": "lit_10_1038_s44160_023_00351_1",
  "schema_version": "1.0.0",
  "source_manifest_path": "provenance/source-files.initial.csv"
}
