{
  "links": [
    {
      "data_license_id": "CC-BY-SA-4.0",
      "git_lfs_oid": "b6dfe8e151a396c5332668c015bce764d23c667240e443495990205c66e4a1e5",
      "physical_dataset_id": "ord_dataset-7acd6ad2bf4d4cff841cad008ab726d5",
      "reaction_count": 960,
      "size_bytes": 72692,
      "source_file": "data/7a/ord_dataset-7acd6ad2bf4d4cff841cad008ab726d5.parquet",
      "source_file_url": "https://github.com/open-reaction-database/ord-data/blob/83f971f586f6ad18f358ae4ae99d045e94ed2066/data/7a/ord_dataset-7acd6ad2bf4d4cff841cad008ab726d5.parquet",
      "source_sha256": "b6dfe8e151a396c5332668c015bce764d23c667240e443495990205c66e4a1e5",
      "upstream_revision": "83f971f586f6ad18f358ae4ae99d045e94ed2066",
      "verification_status": "verified"
    }
  ],
  "logical_dataset_id": "upstream_chemrxiv_64c7e2e1658ec5f7e5808425",
  "schema_version": "1.0.0",
  "source_manifest_path": "provenance/source-files.initial.csv"
}
