{
  "links": [
    {
      "data_license_id": "CC-BY-SA-4.0",
      "git_lfs_oid": "31b7c4762145e5dad973050373cd967bdd85caf3a9858767c83a17fed6c4af36",
      "physical_dataset_id": "ord_dataset-805ad863feef48579d95d86a728035f4",
      "reaction_count": 50688,
      "size_bytes": 5088296,
      "source_file": "data/80/ord_dataset-805ad863feef48579d95d86a728035f4.parquet",
      "source_file_url": "https://github.com/open-reaction-database/ord-data/blob/83f971f586f6ad18f358ae4ae99d045e94ed2066/data/80/ord_dataset-805ad863feef48579d95d86a728035f4.parquet",
      "source_sha256": "31b7c4762145e5dad973050373cd967bdd85caf3a9858767c83a17fed6c4af36",
      "upstream_revision": "83f971f586f6ad18f358ae4ae99d045e94ed2066",
      "verification_status": "verified"
    }
  ],
  "logical_dataset_id": "physical_805ad863feef48579d95d86a728035f4",
  "schema_version": "1.0.0",
  "source_manifest_path": "provenance/source-files.initial.csv"
}
