{
  "links": [
    {
      "data_license_id": "CC-BY-SA-4.0",
      "git_lfs_oid": "78c17145099d29458960ffcb6cec7a8987efeae06b100004be2255ff28e54994",
      "physical_dataset_id": "ord_dataset-d92976309c3a48a3a64a4cf5e7048086",
      "reaction_count": 39347,
      "size_bytes": 3784674,
      "source_file": "data/d9/ord_dataset-d92976309c3a48a3a64a4cf5e7048086.parquet",
      "source_file_url": "https://github.com/open-reaction-database/ord-data/blob/83f971f586f6ad18f358ae4ae99d045e94ed2066/data/d9/ord_dataset-d92976309c3a48a3a64a4cf5e7048086.parquet",
      "source_sha256": "78c17145099d29458960ffcb6cec7a8987efeae06b100004be2255ff28e54994",
      "upstream_revision": "83f971f586f6ad18f358ae4ae99d045e94ed2066",
      "verification_status": "verified"
    }
  ],
  "logical_dataset_id": "physical_d92976309c3a48a3a64a4cf5e7048086",
  "schema_version": "1.0.0",
  "source_manifest_path": "provenance/source-files.initial.csv"
}
